{"$schema":"https://json-schema.org/draft/2020-12/schema","$id":"ox-genesis-render-binding-1.schema.json","title":"OriginX Genesis Render Binding","type":"object","additionalProperties":false,"required":["bindingVersion","tokenId","serial","artSpecHash","renderPlanHash","model","runtime","sampling","resolution","detailPasses","upscalePlan","authority","bindingHash"],"properties":{"bindingVersion":{"const":"OX-GENESIS-RENDER-BINDING-1"},"tokenId":{"type":"integer","minimum":1},"serial":{"type":"string"},"artSpecHash":{"type":"string"},"renderPlanHash":{"type":"string"},"model":{"type":"object"},"runtime":{"type":"object"},"sampling":{"type":"object"},"resolution":{"type":"object"},"detailPasses":{"type":"array"},"upscalePlan":{"type":"object"},"authority":{"type":"object"},"bindingHash":{"type":"string"}}}
