{"artSpecHash":"sha256:68c039f65dab2f4ac0ba2dae1ab695abf9b6dc7af64b9e672a1ae8f44709f28b","authority":{"candidateIsCanonical":false,"executionAllowed":false,"manualQualityReviewRequired":true,"minimumQualityScore":92},"bindingHash":"sha256:e8f49e9b29e71e95b8d7245ffa669251c4d1dda436ee3a7e5f87dabcecf17e03","bindingVersion":"OX-GENESIS-RENDER-BINDING-1","detailPasses":["MACRO_VALIDATION","MESO_REVIEW","MICRO_REVIEW"],"model":{"format":"GGUF","modelHash":"sha256:b8944e9fe0b69b36ae1b5bb0185b3a7b8ef14347fe0fa9af6c64c4829022261f","modelId":"OX-MODEL-002","modelName":"Stable Diffusion 1.5","productionAlias":"OX-GENESIS-MODEL-1","quantization":"Q4_0"},"renderPlanHash":"sha256:aa1f8e5d84d755a91839f8a82ef597362802efde283db09be5bcdd7f304b9efa","resolution":{"height":512,"width":512},"runtime":{"commit":"792bcd344c3fa4d14143b240d5f6cbb324583b18","family":"stable-diffusion.cpp","mmap":true,"paramsBackend":"disk","target":"LOCAL_CPP","threads":4,"vaeTileSize":"128x128","vaeTiling":true},"sampling":{"batchSize":1,"cfg":7.0,"identitySeed":3674790545803592422,"runtimeSeedDerivation":"identitySeed & 0x7fffffffffffffff","sampler":"euler_a","scheduler":"discrete","seed":3674790545803592422,"steps":12},"serial":"#0010","tokenId":10,"upscalePlan":{"enabled":false,"state":"DEFERRED_UNTIL_QUALITY_APPROVAL"}}